### ISSUE TITLE
Spring Config: X-Config-Token not attached on headers

### ISSUE THREAD

**Issue by jeusdi** [spring-cloud/spring-cloud-config#1084]
Config Server `bootstrap.yml`:

    spring:
      application:
        name: configserver
    
      profiles:
        active: vault
    
      cloud:
        config:
          server:
            vault:
              host: ${vault_server_host:localhost}
              port: ${vault_server_port:8200}
              scheme: ${vault_server_scheme:https}
              backend: ${vault_backend:configserver}

Vault secrets:

    $ vault kv get configserver/configclient
    === Data ===
    Key    Value
    ---    -----
    foo    VAUUULT

So, I'm able to get config values using `curl`:

    $ curl -X GET http://localhost:8888/configclient/default -H "X-Config-Token: f7b238dd-425f-52f8-2104-1e37ecf65ede"
    {
       "name":"configclient",
       "profiles":[
          "default"
       ],
       "label":null,
       "version":null,
       "state":null,
       "propertySources":[
          {
             "name":"vault:configclient",
             "source":{
                "foo":"VAUUULT"
             }
          }
       ]
    }

So, I've tried to get `foo` value from Config server from Config client. Config client `bootstrap.yml`:

    spring:
      application:
        name: configclient
      cloud:
        config:
          uri: http://localhost:8888
          headers:
            X-Config-Token: ${vault_token}

However, it seems that Config client is not able to locate Config server:

      .   ____          _            __ _ _
     /\\ / ___'_ __ _ _(_)_ __  __ _ \ \ \ \
    ( ( )\___ | '_ | '_| | '_ \/ _` | \ \ \ \
     \\/  ___)| |_)| | | | | || (_| |  ) ) ) )
      '  |____| .__|_| |_|_| |_\__, | / / / /
     =========|_|==============|___/=/_/_/_/
     :: Spring Boot ::        (v2.0.3.RELEASE)
    
    2018-07-12 10:03:53.809  INFO 15448 --- [           main] c.c.c.ConfigServicePropertySourceLocator : Fetching config from server at : http://localhost:8888
    2018-07-12 10:03:54.239  WARN 15448 --- [           main] c.c.c.ConfigServicePropertySourceLocator : Could not locate PropertySource: 400 null
    2018-07-12 10:03:54.256  INFO 15448 --- [           main] c.t.i.t.s.t.TdevConfigclientApplication  : No active profile set, falling back to default profiles: default

So then, it's getting me that:

> Caused by: java.lang.IllegalArgumentException: Could not resolve placeholder 'foo' in value "${foo}"

`foo` is configured as `@Value("${foo}")`:

    @SpringBootApplication
    @RestController
    public class TdevConfigclientApplication {
    
    	@RequestMapping("/")
        public String home() {
            return "Hello World! " + this.foo;
    	}
    	
    	@Value("${foo}")
    	private String foo;
    
    	public static void main(String[] args) {
    		SpringApplication.run(TdevConfigclientApplication.class, args);
    	}
    }

Here you can see a more detailed config client trace snippet:

    2018-07-12 10:29:05.249  INFO 17299 --- [           main] c.c.c.ConfigServicePropertySourceLocator : Fetching config from server at : http://localhost:8888
    2018-07-12 10:29:05.457 DEBUG 17299 --- [           main] o.s.web.client.RestTemplate              : Created GET request for "http://localhost:8888/configclient/default"
    2018-07-12 10:29:06.023 DEBUG 17299 --- [           main] o.s.web.client.RestTemplate              : Setting request Accept header to [application/json, application/*+json]
    2018-07-12 10:29:06.092 DEBUG 17299 --- [           main] s.n.www.protocol.http.HttpURLConnection  : sun.net.www.MessageHeader@3bb6b7e25 pairs: {GET /configclient/default HTTP/1.1: null}{Accept: application/json, application/*+json}{User-Agent: Java/10.0.1}{Host: localhost:8888}{Connection: keep-alive}
    2018-07-12 10:29:06.121 DEBUG 17299 --- [           main] s.n.www.protocol.http.HttpURLConnection  : sun.net.www.MessageHeader@3b1892d05 pairs: {null: HTTP/1.1 400}{Content-Type: application/json;charset=UTF-8}{Transfer-Encoding: chunked}{Date: Thu, 12 Jul 2018 08:29:06 GMT}{Connection: close}
    2018-07-12 10:29:06.145 DEBUG 17299 --- [           main] o.s.web.client.RestTemplate              : GET request for "http://localhost:8888/configclient/default" resulted in 400 (null); invoking error handler
    2018-07-12 10:29:06.162  WARN 17299 --- [           main] c.c.c.ConfigServicePropertySourceLocator : Could not locate PropertySource: 400 null

I've been inspecting tcp traffic:

```
tcpdump: verbose output suppressed, use -v or -vv for full protocol decode
listening on lo, link-type EN10MB (Ethernet), capture size 262144 bytes
11:58:40.399210 IP localhost.33910 > localhost.8888: Flags [P.], seq 2424887549:2424887704, ack 2616539579, win 342, options [nop,nop,TS val 3669302165 ecr 3669302159], length 155
E....H@.@.P..........v".......9....V.......
........GET /configclient/default HTTP/1.1
Accept: application/json, application/*+json
User-Agent: Java/10.0.1
Host: localhost:8888
Connection: keep-alive


11:58:40.474800 IP localhost.8888 > localhost.33910: Flags [P.], seq 1:316, ack 155, win 350, options [nop,nop,TS val 3669302241 ecr 3669302165], length 315
E..o
.@.@.1........."..v..9........^.c.....
........HTTP/1.1 400 
Content-Type: application/json;charset=UTF-8
Transfer-Encoding: chunked
Date: Thu, 12 Jul 2018 09:58:40 GMT
Connection: close

a2
{"timestamp":"2018-07-12T09:58:40.468+0000","status":400,"error":"Bad Request","message":"Missing required header: X-Config-Token","path":"/configclient/default"}

11:58:40.486753 IP localhost.8888 > localhost.33910: Flags [P.], seq 316:321, ack 155, win 350, options [nop,nop,TS val 3669302253 ecr 3669302241], length 5
E..9
.@.@.2........."..v..:........^.-.....
........0
```

As you can see, I've set up `X-Config-Token` into `bootstrap.yml` file, however, it `X-Config-Token` is not attached in headers.

This is my `pom.xml`:

```
<?xml version="1.0" encoding="UTF-8"?>
<project xmlns="http://maven.apache.org/POM/4.0.0" xmlns:xsi="http://www.w3.org/2001/XMLSchema-instance"
	xsi:schemaLocation="http://maven.apache.org/POM/4.0.0 http://maven.apache.org/xsd/maven-4.0.0.xsd">
	<modelVersion>4.0.0</modelVersion>

	<groupId>com.tsystems.iberia.tdev.sccc</groupId>
	<artifactId>configclient</artifactId>
	<version>0.0.1-SNAPSHOT</version>
	<packaging>jar</packaging>

	<name>configclient</name>
	<description>Demo project for Spring Boot</description>

	<parent>
		<groupId>org.springframework.boot</groupId>
		<artifactId>spring-boot-starter-parent</artifactId>
		<version>2.0.3.RELEASE</version>
		<relativePath/><!-- lookup parent from repository -->
	</parent>

	<properties>
		<project.build.sourceEncoding>UTF-8</project.build.sourceEncoding>
		<project.reporting.outputEncoding>UTF-8</project.reporting.outputEncoding>
		<java.version>1.8</java.version>
		<spring-cloud.version>Finchley.RELEASE</spring-cloud.version>
	</properties>

	<dependencies>
		<dependency>
			<groupId>org.springframework.boot</groupId>
			<artifactId>spring-boot-starter-actuator</artifactId>
		</dependency>
		<dependency>
			<groupId>org.springframework.boot</groupId>
			<artifactId>spring-boot-starter-web</artifactId>
		</dependency>
		<dependency>
			<groupId>org.springframework.cloud</groupId>
			<artifactId>spring-cloud-starter-config</artifactId>
		</dependency>

		<dependency>
			<groupId>org.springframework.boot</groupId>
			<artifactId>spring-boot-starter-test</artifactId>
			<scope>test</scope>
		</dependency>
	</dependencies>

	<dependencyManagement>
		<dependencies>
			<dependency>
				<groupId>org.springframework.cloud</groupId>
				<artifactId>spring-cloud-dependencies</artifactId>
				<version>${spring-cloud.version}</version>
				<type>pom</type>
				<scope>import</scope>
			</dependency>
		</dependencies>
	</dependencyManagement>

	<build>
		<plugins>
			<plugin>
				<groupId>org.springframework.boot</groupId>
				<artifactId>spring-boot-maven-plugin</artifactId>
			</plugin>
		</plugins>
	</build>


</project>
```

**Comment by jeusdi** [comment]
I've been inspecting tcp traffic:

```
tcpdump: verbose output suppressed, use -v or -vv for full protocol decode
listening on lo, link-type EN10MB (Ethernet), capture size 262144 bytes
11:58:40.399210 IP localhost.33910 > localhost.8888: Flags [P.], seq 2424887549:2424887704, ack 2616539579, win 342, options [nop,nop,TS val 3669302165 ecr 3669302159], length 155
E....H@.@.P..........v".......9....V.......
........GET /configclient/default HTTP/1.1
Accept: application/json, application/*+json
User-Agent: Java/10.0.1
Host: localhost:8888
Connection: keep-alive


11:58:40.474800 IP localhost.8888 > localhost.33910: Flags [P.], seq 1:316, ack 155, win 350, options [nop,nop,TS val 3669302241 ecr 3669302165], length 315
E..o
.@.@.1........."..v..9........^.c.....
........HTTP/1.1 400 
Content-Type: application/json;charset=UTF-8
Transfer-Encoding: chunked
Date: Thu, 12 Jul 2018 09:58:40 GMT
Connection: close

a2
{"timestamp":"2018-07-12T09:58:40.468+0000","status":400,"error":"Bad Request","message":"Missing required header: X-Config-Token","path":"/configclient/default"}

11:58:40.486753 IP localhost.8888 > localhost.33910: Flags [P.], seq 316:321, ack 155, win 350, options [nop,nop,TS val 3669302253 ecr 3669302241], length 5
E..9
.@.@.2........."..v..:........^.-.....
........0
```

As you can see, I've set up `X-Config-Token` into `bootstrap.yml` file, however, it `X-Config-Token` is not attached in headers.

**Comment by ryanjbaxter** [comment]
You need to set `spring.cloud.config.token`. http://cloud.spring.io/spring-cloud-static/Finchley.RELEASE/single/spring-cloud.html#_vault

**Comment by ryanjbaxter** [comment]
Please reopen if this does not solve your issue.

**Comment by navuniverse** [comment]
I am getting the same error while trying to use vault.

Here is my configclient `bootstrap.yml`

`spring:
  application:
    name: configclient
  cloud:
    vault:
      token: f474964a-89bf-39e6-2e37-3d7de918f762
      uri: http://localhost:8888
    config:
      token: f474964a-89bf-39e6-2e37-3d7de918f762
      uri: http://localhost:8888
      headers:
        X-Vault-Token: f474964a-89bf-39e6-2e37-3d7de918f762
server:
  port: 8080`

I am able to use vault from CLI using the same token. The error I am getting is -
`2018-10-11 18:07:49.946  INFO 97999 --- [           main] s.c.a.AnnotationConfigApplicationContext : Refreshing org.springframework.context.annotation.AnnotationConfigApplicationContext@3fc2959f: startup date [Thu Oct 11 18:07:49 IST 2018]; root of context hierarchy
2018-10-11 18:07:50.389  INFO 97999 --- [           main] trationDelegate$BeanPostProcessorChecker : Bean 'configurationPropertiesRebinderAutoConfiguration' of type [org.springframework.cloud.autoconfigure.ConfigurationPropertiesRebinderAutoConfiguration$$EnhancerBySpringCGLIB$$c21aa722] is not eligible for getting processed by all BeanPostProcessors (for example: not eligible for auto-proxying)
2018-10-11 18:07:50.913  INFO 97999 --- [           main] o.s.s.c.ThreadPoolTaskScheduler          : Initializing ExecutorService 

  .   ____          _            __ _ _
 /\\ / ___'_ __ _ _(_)_ __  __ _ \ \ \ \
( ( )\___ | '_ | '_| | '_ \/ _` | \ \ \ \
 \\/  ___)| |_)| | | | | || (_| |  ) ) ) )
  '  |____| .__|_| |_|_| |_\__, | / / / /
 =========|_|==============|___/=/_/_/_/
 :: Spring Boot ::        (v2.0.5.RELEASE)

2018-10-11 18:07:53.579  WARN 97999 --- [           main] o.s.v.a.LifecycleAwareSessionManager     : Cannot enhance VaultToken to a LoginToken: Token self-lookup failed: 500 {"timestamp":"2018-10-11T12:37:53.557+0000","status":500,"error":"Internal Server Error","message":"No such label: token","path":"/v1/auth/token/lookup-self"}
2018-10-11 18:07:53.603  WARN 97999 --- [           main] LeaseEventPublisher$LoggingErrorListener : [RequestedSecret [path='secret/configclient', mode=ROTATE]] Lease [leaseId='null', leaseDuration=PT0S, renewable=false] Status 400 secret/configclient: {"timestamp":"2018-10-11T12:37:53.594+0000","status":400,"error":"Bad Request","message":"Missing required header: X-Config-Token","path":"/v1/secret/configclient"}

org.springframework.vault.VaultException: Status 400 secret/configclient: {"timestamp":"2018-10-11T12:37:53.594+0000","status":400,"error":"Bad Request","message":"Missing required header: X-Config-Token","path":"/v1/secret/configclient"}
	at org.springframework.vault.client.VaultResponses.buildException(VaultResponses.java:89) ~[spring-vault-core-2.0.1.RELEASE.jar:2.0.1.RELEASE]
	at org.springframework.vault.client.VaultResponses.buildException(VaultResponses.java:81) ~[spring-vault-core-2.0.1.RELEASE.jar:2.0.1.RELEASE]
	at org.springframework.vault.core.VaultTemplate.lambda$doRead$1(VaultTemplate.java:328) ~[spring-vault-core-2.0.1.RELEASE.jar:2.0.1.RELEASE]
	at org.springframework.vault.core.VaultTemplate.doWithSession(VaultTemplate.java:307) ~[spring-vault-core-2.0.1.RELEASE.jar:2.0.1.RELEASE]
	at org.springframework.vault.core.VaultTemplate.doRead(VaultTemplate.java:317) ~[spring-vault-core-2.0.1.RELEASE.jar:2.0.1.RELEASE]
	at org.springframework.vault.core.VaultTemplate.read(VaultTemplate.java:212) ~[spring-vault-core-2.0.1.RELEASE.jar:2.0.1.RELEASE]
	at org.springframework.vault.core.lease.SecretLeaseContainer.doGetSecrets(SecretLeaseContainer.java:545) [spring-vault-core-2.0.1.RELEASE.jar:2.0.1.RELEASE]
	at org.springframework.vault.core.lease.SecretLeaseContainer.start(SecretLeaseContainer.java:357) [spring-vault-core-2.0.1.RELEASE.jar:2.0.1.RELEASE]
	at org.springframework.vault.core.lease.SecretLeaseContainer.addRequestedSecret(SecretLeaseContainer.java:316) [spring-vault-core-2.0.1.RELEASE.jar:2.0.1.RELEASE]
	at org.springframework.vault.core.env.LeaseAwareVaultPropertySource.loadProperties(LeaseAwareVaultPropertySource.java:147) [spring-vault-core-2.0.1.RELEASE.jar:2.0.1.RELEASE]
	at org.springframework.vault.core.env.LeaseAwareVaultPropertySource.<init>(LeaseAwareVaultPropertySource.java:133) [spring-vault-core-2.0.1.RELEASE.jar:2.0.1.RELEASE]
	at org.springframework.cloud.vault.config.LeasingVaultPropertySourceLocator.createVaultPropertySource(LeasingVaultPropertySourceLocator.java:151) [spring-cloud-vault-config-2.0.1.RELEASE.jar:2.0.1.RELEASE]
	at org.springframework.cloud.vault.config.LeasingVaultPropertySourceLocator.createVaultPropertySource(LeasingVaultPropertySourceLocator.java:88) [spring-cloud-vault-config-2.0.1.RELEASE.jar:2.0.1.RELEASE]
	at org.springframework.cloud.vault.config.VaultPropertySourceLocatorSupport.doCreatePropertySources(VaultPropertySourceLocatorSupport.java:170) [spring-cloud-vault-config-2.0.1.RELEASE.jar:2.0.1.RELEASE]
	at org.springframework.cloud.vault.config.VaultPropertySourceLocatorSupport.createCompositePropertySource(VaultPropertySourceLocatorSupport.java:145) [spring-cloud-vault-config-2.0.1.RELEASE.jar:2.0.1.RELEASE]
	at org.springframework.cloud.vault.config.VaultPropertySourceLocatorSupport.locate(VaultPropertySourceLocatorSupport.java:116) [spring-cloud-vault-config-2.0.1.RELEASE.jar:2.0.1.RELEASE]
	at org.springframework.cloud.bootstrap.config.PropertySourceBootstrapConfiguration.initialize(PropertySourceBootstrapConfiguration.java:94) [spring-cloud-context-2.0.1.RELEASE.jar:2.0.1.RELEASE]
	at org.springframework.boot.SpringApplication.applyInitializers(SpringApplication.java:654) [spring-boot-2.0.5.RELEASE.jar:2.0.5.RELEASE]
	at org.springframework.boot.SpringApplication.prepareContext(SpringApplication.java:390) [spring-boot-2.0.5.RELEASE.jar:2.0.5.RELEASE]
	at org.springframework.boot.SpringApplication.run(SpringApplication.java:331) [spring-boot-2.0.5.RELEASE.jar:2.0.5.RELEASE]
	at org.springframework.boot.SpringApplication.run(SpringApplication.java:1277) [spring-boot-2.0.5.RELEASE.jar:2.0.5.RELEASE]
	at org.springframework.boot.SpringApplication.run(SpringApplication.java:1265) [spring-boot-2.0.5.RELEASE.jar:2.0.5.RELEASE]
	at com.rockingengineering.vault.VaultApplication.main(VaultApplication.java:10) [classes/:na]

2018-10-11 18:07:53.632  WARN 97999 --- [           main] LeaseEventPublisher$LoggingErrorListener : [RequestedSecret [path='secret/application', mode=ROTATE]] Lease [leaseId='null', leaseDuration=PT0S, renewable=false] Status 400 secret/application: {"timestamp":"2018-10-11T12:37:53.630+0000","status":400,"error":"Bad Request","message":"Missing required header: X-Config-Token","path":"/v1/secret/application"}

org.springframework.vault.VaultException: Status 400 secret/application: {"timestamp":"2018-10-11T12:37:53.630+0000","status":400,"error":"Bad Request","message":"Missing required header: X-Config-Token","path":"/v1/secret/application"}
	at org.springframework.vault.client.VaultResponses.buildException(VaultResponses.java:89) ~[spring-vault-core-2.0.1.RELEASE.jar:2.0.1.RELEASE]
	at org.springframework.vault.client.VaultResponses.buildException(VaultResponses.java:81) ~[spring-vault-core-2.0.1.RELEASE.jar:2.0.1.RELEASE]
	at org.springframework.vault.core.VaultTemplate.lambda$doRead$1(VaultTemplate.java:328) ~[spring-vault-core-2.0.1.RELEASE.jar:2.0.1.RELEASE]
	at org.springframework.vault.core.VaultTemplate.doWithSession(VaultTemplate.java:307) ~[spring-vault-core-2.0.1.RELEASE.jar:2.0.1.RELEASE]
	at org.springframework.vault.core.VaultTemplate.doRead(VaultTemplate.java:317) ~[spring-vault-core-2.0.1.RELEASE.jar:2.0.1.RELEASE]
	at org.springframework.vault.core.VaultTemplate.read(VaultTemplate.java:212) ~[spring-vault-core-2.0.1.RELEASE.jar:2.0.1.RELEASE]
	at org.springframework.vault.core.lease.SecretLeaseContainer.doGetSecrets(SecretLeaseContainer.java:545) [spring-vault-core-2.0.1.RELEASE.jar:2.0.1.RELEASE]
	at org.springframework.vault.core.lease.SecretLeaseContainer.start(SecretLeaseContainer.java:357) [spring-vault-core-2.0.1.RELEASE.jar:2.0.1.RELEASE]
	at org.springframework.vault.core.lease.SecretLeaseContainer.addRequestedSecret(SecretLeaseContainer.java:316) [spring-vault-core-2.0.1.RELEASE.jar:2.0.1.RELEASE]
	at org.springframework.vault.core.env.LeaseAwareVaultPropertySource.loadProperties(LeaseAwareVaultPropertySource.java:147) [spring-vault-core-2.0.1.RELEASE.jar:2.0.1.RELEASE]
	at org.springframework.vault.core.env.LeaseAwareVaultPropertySource.<init>(LeaseAwareVaultPropertySource.java:133) [spring-vault-core-2.0.1.RELEASE.jar:2.0.1.RELEASE]
	at org.springframework.cloud.vault.config.LeasingVaultPropertySourceLocator.createVaultPropertySource(LeasingVaultPropertySourceLocator.java:151) [spring-cloud-vault-config-2.0.1.RELEASE.jar:2.0.1.RELEASE]
	at org.springframework.cloud.vault.config.LeasingVaultPropertySourceLocator.createVaultPropertySource(LeasingVaultPropertySourceLocator.java:88) [spring-cloud-vault-config-2.0.1.RELEASE.jar:2.0.1.RELEASE]
	at org.springframework.cloud.vault.config.VaultPropertySourceLocatorSupport.doCreatePropertySources(VaultPropertySourceLocatorSupport.java:170) [spring-cloud-vault-config-2.0.1.RELEASE.jar:2.0.1.RELEASE]
	at org.springframework.cloud.vault.config.VaultPropertySourceLocatorSupport.createCompositePropertySource(VaultPropertySourceLocatorSupport.java:145) [spring-cloud-vault-config-2.0.1.RELEASE.jar:2.0.1.RELEASE]
	at org.springframework.cloud.vault.config.VaultPropertySourceLocatorSupport.locate(VaultPropertySourceLocatorSupport.java:116) [spring-cloud-vault-config-2.0.1.RELEASE.jar:2.0.1.RELEASE]
	at org.springframework.cloud.bootstrap.config.PropertySourceBootstrapConfiguration.initialize(PropertySourceBootstrapConfiguration.java:94) [spring-cloud-context-2.0.1.RELEASE.jar:2.0.1.RELEASE]
	at org.springframework.boot.SpringApplication.applyInitializers(SpringApplication.java:654) [spring-boot-2.0.5.RELEASE.jar:2.0.5.RELEASE]
	at org.springframework.boot.SpringApplication.prepareContext(SpringApplication.java:390) [spring-boot-2.0.5.RELEASE.jar:2.0.5.RELEASE]
	at org.springframework.boot.SpringApplication.run(SpringApplication.java:331) [spring-boot-2.0.5.RELEASE.jar:2.0.5.RELEASE]
	at org.springframework.boot.SpringApplication.run(SpringApplication.java:1277) [spring-boot-2.0.5.RELEASE.jar:2.0.5.RELEASE]
	at org.springframework.boot.SpringApplication.run(SpringApplication.java:1265) [spring-boot-2.0.5.RELEASE.jar:2.0.5.RELEASE]
	at com.rockingengineering.vault.VaultApplication.main(VaultApplication.java:10) [classes/:na]

2018-10-11 18:07:53.633  INFO 97999 --- [           main] b.c.PropertySourceBootstrapConfiguration : Located property source: CompositePropertySource {name='vault', propertySources=[LeaseAwareVaultPropertySource {name='secret/configclient'}, LeaseAwareVaultPropertySource {name='secret/application'}]}
2018-10-11 18:07:53.639  INFO 97999 --- [           main] c.c.c.ConfigServicePropertySourceLocator : Fetching config from server at : http://localhost:8888
2018-10-11 18:07:56.496  INFO 97999 --- [           main] c.c.c.ConfigServicePropertySourceLocator : Located environment: name=configclient, profiles=[default], label=null, version=null, state=null
2018-10-11 18:07:56.496  INFO 97999 --- [           main] b.c.PropertySourceBootstrapConfiguration : Located property source: CompositePropertySource {name='configService', propertySources=[MapPropertySource {name='https://github.com/weekly-drafts/config-repo-spring-cloud-configserver-vault/configclient.yml'}]}
2018-10-11 18:07:56.502  INFO 97999 --- [           main] c.r.vault.VaultApplication               : No active profile set, falling back to default profiles: default
2018-10-11 18:07:56.516  INFO 97999 --- [           main] ConfigServletWebServerApplicationContext : Refreshing org.springframework.boot.web.servlet.context.AnnotationConfigServletWebServerApplicationContext@60a2630a: startup date [Thu Oct 11 18:07:56 IST 2018]; parent: org.springframework.context.annotation.AnnotationConfigApplicationContext@3fc2959f
2018-10-11 18:07:57.909  INFO 97999 --- [           main] o.s.cloud.context.scope.GenericScope     : BeanFactory id=e9255d82-de63-3800-b389-53a2229e780a
2018-10-11 18:07:58.032  INFO 97999 --- [           main] trationDelegate$BeanPostProcessorChecker : Bean 'org.springframework.cloud.autoconfigure.ConfigurationPropertiesRebinderAutoConfiguration' of type [org.springframework.cloud.autoconfigure.ConfigurationPropertiesRebinderAutoConfiguration$$EnhancerBySpringCGLIB$$c21aa722] is not eligible for getting processed by all BeanPostProcessors (for example: not eligible for auto-proxying)
2018-10-11 18:07:58.564  INFO 97999 --- [           main] o.s.b.w.embedded.tomcat.TomcatWebServer  : Tomcat initialized with port(s): 8080 (http)
2018-10-11 18:07:58.589  INFO 97999 --- [           main] o.apache.catalina.core.StandardService   : Starting service [Tomcat]
2018-10-11 18:07:58.589  INFO 97999 --- [           main] org.apache.catalina.core.StandardEngine  : Starting Servlet Engine: Apache Tomcat/8.5.34
2018-10-11 18:07:58.593  INFO 97999 --- [ost-startStop-1] o.a.catalina.core.AprLifecycleListener   : The APR based Apache Tomcat Native library which allows optimal performance in production environments was not found on the java.library.path: [/Users/naveen/Library/Java/Extensions:/Library/Java/Extensions:/Network/Library/Java/Extensions:/System/Library/Java/Extensions:/usr/lib/java:.]
2018-10-11 18:07:58.706  INFO 97999 --- [ost-startStop-1] o.a.c.c.C.[Tomcat].[localhost].[/]       : Initializing Spring embedded WebApplicationContext
2018-10-11 18:07:58.706  INFO 97999 --- [ost-startStop-1] o.s.web.context.ContextLoader            : Root WebApplicationContext: initialization completed in 2190 ms
2018-10-11 18:07:59.376  INFO 97999 --- [ost-startStop-1] o.s.b.w.servlet.FilterRegistrationBean   : Mapping filter: 'characterEncodingFilter' to: [/*]
2018-10-11 18:07:59.377  INFO 97999 --- [ost-startStop-1] o.s.b.w.servlet.FilterRegistrationBean   : Mapping filter: 'webMvcMetricsFilter' to: [/*]
2018-10-11 18:07:59.377  INFO 97999 --- [ost-startStop-1] o.s.b.w.servlet.FilterRegistrationBean   : Mapping filter: 'hiddenHttpMethodFilter' to: [/*]
2018-10-11 18:07:59.377  INFO 97999 --- [ost-startStop-1] o.s.b.w.servlet.FilterRegistrationBean   : Mapping filter: 'httpPutFormContentFilter' to: [/*]
2018-10-11 18:07:59.377  INFO 97999 --- [ost-startStop-1] o.s.b.w.servlet.FilterRegistrationBean   : Mapping filter: 'requestContextFilter' to: [/*]
2018-10-11 18:07:59.377  INFO 97999 --- [ost-startStop-1] o.s.b.w.servlet.FilterRegistrationBean   : Mapping filter: 'httpTraceFilter' to: [/*]
2018-10-11 18:07:59.377  INFO 97999 --- [ost-startStop-1] o.s.b.w.servlet.ServletRegistrationBean  : Servlet dispatcherServlet mapped to [/]
2018-10-11 18:07:59.965  INFO 97999 --- [           main] s.w.s.m.m.a.RequestMappingHandlerMapping : Mapped "{[/property],methods=[GET]}" onto public org.springframework.http.ResponseEntity<java.lang.String> com.rockingengineering.vault.controller.VaultController.getProperty()
2018-10-11 18:07:59.966  INFO 97999 --- [           main] s.w.s.m.m.a.RequestMappingHandlerMapping : Mapped "{[/property/vault],methods=[GET]}" onto public org.springframework.http.ResponseEntity<java.lang.String> com.rockingengineering.vault.controller.VaultController.getPropertyFromVault()
2018-10-11 18:07:59.969  INFO 97999 --- [           main] s.w.s.m.m.a.RequestMappingHandlerMapping : Mapped "{[/v2/api-docs],methods=[GET],produces=[application/json || application/hal+json]}" onto public org.springframework.http.ResponseEntity<springfox.documentation.spring.web.json.Json> springfox.documentation.swagger2.web.Swagger2Controller.getDocumentation(java.lang.String,javax.servlet.http.HttpServletRequest)
2018-10-11 18:07:59.973  INFO 97999 --- [           main] s.w.s.m.m.a.RequestMappingHandlerMapping : Mapped "{[/swagger-resources/configuration/ui]}" onto org.springframework.http.ResponseEntity<springfox.documentation.swagger.web.UiConfiguration> springfox.documentation.swagger.web.ApiResourceController.uiConfiguration()
2018-10-11 18:07:59.974  INFO 97999 --- [           main] s.w.s.m.m.a.RequestMappingHandlerMapping : Mapped "{[/swagger-resources/configuration/security]}" onto org.springframework.http.ResponseEntity<springfox.documentation.swagger.web.SecurityConfiguration> springfox.documentation.swagger.web.ApiResourceController.securityConfiguration()
2018-10-11 18:07:59.975  INFO 97999 --- [           main] s.w.s.m.m.a.RequestMappingHandlerMapping : Mapped "{[/swagger-resources]}" onto org.springframework.http.ResponseEntity<java.util.List<springfox.documentation.swagger.web.SwaggerResource>> springfox.documentation.swagger.web.ApiResourceController.swaggerResources()
2018-10-11 18:07:59.978  INFO 97999 --- [           main] s.w.s.m.m.a.RequestMappingHandlerMapping : Mapped "{[/error]}" onto public org.springframework.http.ResponseEntity<java.util.Map<java.lang.String, java.lang.Object>> org.springframework.boot.autoconfigure.web.servlet.error.BasicErrorController.error(javax.servlet.http.HttpServletRequest)
2018-10-11 18:07:59.979  INFO 97999 --- [           main] s.w.s.m.m.a.RequestMappingHandlerMapping : Mapped "{[/error],produces=[text/html]}" onto public org.springframework.web.servlet.ModelAndView org.springframework.boot.autoconfigure.web.servlet.error.BasicErrorController.errorHtml(javax.servlet.http.HttpServletRequest,javax.servlet.http.HttpServletResponse)
2018-10-11 18:08:00.101  INFO 97999 --- [           main] o.s.b.a.e.web.EndpointLinksResolver      : Exposing 2 endpoint(s) beneath base path '/actuator'
2018-10-11 18:08:00.116  INFO 97999 --- [           main] s.b.a.e.w.s.WebMvcEndpointHandlerMapping : Mapped "{[/actuator/health],methods=[GET],produces=[application/vnd.spring-boot.actuator.v2+json || application/json]}" onto public java.lang.Object org.springframework.boot.actuate.endpoint.web.servlet.AbstractWebMvcEndpointHandlerMapping$OperationHandler.handle(javax.servlet.http.HttpServletRequest,java.util.Map<java.lang.String, java.lang.String>)
2018-10-11 18:08:00.117  INFO 97999 --- [           main] s.b.a.e.w.s.WebMvcEndpointHandlerMapping : Mapped "{[/actuator/info],methods=[GET],produces=[application/vnd.spring-boot.actuator.v2+json || application/json]}" onto public java.lang.Object org.springframework.boot.actuate.endpoint.web.servlet.AbstractWebMvcEndpointHandlerMapping$OperationHandler.handle(javax.servlet.http.HttpServletRequest,java.util.Map<java.lang.String, java.lang.String>)
2018-10-11 18:08:00.118  INFO 97999 --- [           main] s.b.a.e.w.s.WebMvcEndpointHandlerMapping : Mapped "{[/actuator],methods=[GET],produces=[application/vnd.spring-boot.actuator.v2+json || application/json]}" onto protected java.util.Map<java.lang.String, java.util.Map<java.lang.String, org.springframework.boot.actuate.endpoint.web.Link>> org.springframework.boot.actuate.endpoint.web.servlet.WebMvcEndpointHandlerMapping.links(javax.servlet.http.HttpServletRequest,javax.servlet.http.HttpServletResponse)
2018-10-11 18:08:00.266  INFO 97999 --- [           main] o.s.w.s.handler.SimpleUrlHandlerMapping  : Mapped URL path [/**/favicon.ico] onto handler of type [class org.springframework.web.servlet.resource.ResourceHttpRequestHandler]
2018-10-11 18:08:00.397  INFO 97999 --- [           main] s.w.s.m.m.a.RequestMappingHandlerAdapter : Looking for @ControllerAdvice: org.springframework.boot.web.servlet.context.AnnotationConfigServletWebServerApplicationContext@60a2630a: startup date [Thu Oct 11 18:07:56 IST 2018]; parent: org.springframework.context.annotation.AnnotationConfigApplicationContext@3fc2959f
2018-10-11 18:08:00.443  INFO 97999 --- [           main] o.s.w.s.handler.SimpleUrlHandlerMapping  : Mapped URL path [/webjars/**] onto handler of type [class org.springframework.web.servlet.resource.ResourceHttpRequestHandler]
2018-10-11 18:08:00.443  INFO 97999 --- [           main] o.s.w.s.handler.SimpleUrlHandlerMapping  : Mapped URL path [/**] onto handler of type [class org.springframework.web.servlet.resource.ResourceHttpRequestHandler]
2018-10-11 18:08:00.798  INFO 97999 --- [           main] o.s.j.e.a.AnnotationMBeanExporter        : Registering beans for JMX exposure on startup
2018-10-11 18:08:00.811  INFO 97999 --- [           main] o.s.j.e.a.AnnotationMBeanExporter        : Bean with name 'environmentManager' has been autodetected for JMX exposure
2018-10-11 18:08:00.812  INFO 97999 --- [           main] o.s.j.e.a.AnnotationMBeanExporter        : Bean with name 'refreshScope' has been autodetected for JMX exposure
2018-10-11 18:08:00.815  INFO 97999 --- [           main] o.s.j.e.a.AnnotationMBeanExporter        : Bean with name 'configurationPropertiesRebinder' has been autodetected for JMX exposure
2018-10-11 18:08:00.821  INFO 97999 --- [           main] o.s.j.e.a.AnnotationMBeanExporter        : Located managed bean 'environmentManager': registering with JMX server as MBean [org.springframework.cloud.context.environment:name=environmentManager,type=EnvironmentManager]
2018-10-11 18:08:00.831  INFO 97999 --- [           main] o.s.j.e.a.AnnotationMBeanExporter        : Located managed bean 'refreshScope': registering with JMX server as MBean [org.springframework.cloud.context.scope.refresh:name=refreshScope,type=RefreshScope]
2018-10-11 18:08:00.842  INFO 97999 --- [           main] o.s.j.e.a.AnnotationMBeanExporter        : Located managed bean 'configurationPropertiesRebinder': registering with JMX server as MBean [org.springframework.cloud.context.properties:name=configurationPropertiesRebinder,context=60a2630a,type=ConfigurationPropertiesRebinder]
2018-10-11 18:08:00.985  INFO 97999 --- [           main] o.s.c.support.DefaultLifecycleProcessor  : Starting beans in phase 2147483647
2018-10-11 18:08:00.986  INFO 97999 --- [           main] d.s.w.p.DocumentationPluginsBootstrapper : Context refreshed
2018-10-11 18:08:01.004  INFO 97999 --- [           main] d.s.w.p.DocumentationPluginsBootstrapper : Found 1 custom documentation plugin(s)
2018-10-11 18:08:01.016  INFO 97999 --- [           main] s.d.s.w.s.ApiListingReferenceScanner     : Scanning for api listing references
2018-10-11 18:08:01.099  WARN 97999 --- [           main] ConfigServletWebServerApplicationContext : Exception encountered during context initialization - cancelling refresh attempt: org.springframework.beans.factory.BeanCreationException: Error creating bean with name 'scopedTarget.vaultController': Injection of autowired dependencies failed; nested exception is java.lang.IllegalArgumentException: Could not resolve placeholder 'client.pseudo.property.vault' in value "${client.pseudo.property.vault}"
2018-10-11 18:08:01.101  INFO 97999 --- [           main] o.s.j.e.a.AnnotationMBeanExporter        : Unregistering JMX-exposed beans on shutdown
2018-10-11 18:08:01.102  INFO 97999 --- [           main] o.s.j.e.a.AnnotationMBeanExporter        : Unregistering JMX-exposed beans
2018-10-11 18:08:01.107  INFO 97999 --- [           main] o.apache.catalina.core.StandardService   : Stopping service [Tomcat]
2018-10-11 18:08:01.131  INFO 97999 --- [           main] ConditionEvaluationReportLoggingListener : 

Error starting ApplicationContext. To display the conditions report re-run your application with 'debug' enabled.
2018-10-11 18:08:01.138 ERROR 97999 --- [           main] o.s.boot.SpringApplication               : Application run failed

org.springframework.beans.factory.BeanCreationException: Error creating bean with name 'scopedTarget.vaultController': Injection of autowired dependencies failed; nested exception is java.lang.IllegalArgumentException: Could not resolve placeholder 'client.pseudo.property.vault' in value "${client.pseudo.property.vault}"
	at org.springframework.beans.factory.annotation.AutowiredAnnotationBeanPostProcessor.postProcessPropertyValues(AutowiredAnnotationBeanPostProcessor.java:378) ~[spring-beans-5.0.9.RELEASE.jar:5.0.9.RELEASE]
	at org.springframework.beans.factory.support.AbstractAutowireCapableBeanFactory.populateBean(AbstractAutowireCapableBeanFactory.java:1341) ~[spring-beans-5.0.9.RELEASE.jar:5.0.9.RELEASE]
	at org.springframework.beans.factory.support.AbstractAutowireCapableBeanFactory.doCreateBean(AbstractAutowireCapableBeanFactory.java:572) ~[spring-beans-5.0.9.RELEASE.jar:5.0.9.RELEASE]
	at org.springframework.beans.factory.support.AbstractAutowireCapableBeanFactory.createBean(AbstractAutowireCapableBeanFactory.java:495) ~[spring-beans-5.0.9.RELEASE.jar:5.0.9.RELEASE]
	at org.springframework.beans.factory.support.AbstractBeanFactory.lambda$doGetBean$1(AbstractBeanFactory.java:353) ~[spring-beans-5.0.9.RELEASE.jar:5.0.9.RELEASE]
	at org.springframework.cloud.context.scope.GenericScope$BeanLifecycleWrapper.getBean(GenericScope.java:390) ~[spring-cloud-context-2.0.1.RELEASE.jar:2.0.1.RELEASE]
	at org.springframework.cloud.context.scope.GenericScope.get(GenericScope.java:184) ~[spring-cloud-context-2.0.1.RELEASE.jar:2.0.1.RELEASE]
	at org.springframework.beans.factory.support.AbstractBeanFactory.doGetBean(AbstractBeanFactory.java:350) ~[spring-beans-5.0.9.RELEASE.jar:5.0.9.RELEASE]
	at org.springframework.beans.factory.support.AbstractBeanFactory.getBean(AbstractBeanFactory.java:199) ~[spring-beans-5.0.9.RELEASE.jar:5.0.9.RELEASE]
	at org.springframework.context.support.AbstractApplicationContext.getBean(AbstractApplicationContext.java:1089) ~[spring-context-5.0.9.RELEASE.jar:5.0.9.RELEASE]
	at org.springframework.cloud.context.scope.refresh.RefreshScope.eagerlyInitialize(RefreshScope.java:126) ~[spring-cloud-context-2.0.1.RELEASE.jar:2.0.1.RELEASE]
	at org.springframework.cloud.context.scope.refresh.RefreshScope.start(RefreshScope.java:117) ~[spring-cloud-context-2.0.1.RELEASE.jar:2.0.1.RELEASE]
	at sun.reflect.NativeMethodAccessorImpl.invoke0(Native Method) ~[na:1.8.0_121]
	at sun.reflect.NativeMethodAccessorImpl.invoke(NativeMethodAccessorImpl.java:62) ~[na:1.8.0_121]
	at sun.reflect.DelegatingMethodAccessorImpl.invoke(DelegatingMethodAccessorImpl.java:43) ~[na:1.8.0_121]
	at java.lang.reflect.Method.invoke(Method.java:498) ~[na:1.8.0_121]
	at org.springframework.context.event.ApplicationListenerMethodAdapter.doInvoke(ApplicationListenerMethodAdapter.java:261) ~[spring-context-5.0.9.RELEASE.jar:5.0.9.RELEASE]
	at org.springframework.context.event.ApplicationListenerMethodAdapter.processEvent(ApplicationListenerMethodAdapter.java:180) ~[spring-context-5.0.9.RELEASE.jar:5.0.9.RELEASE]
	at org.springframework.context.event.ApplicationListenerMethodAdapter.onApplicationEvent(ApplicationListenerMethodAdapter.java:142) ~[spring-context-5.0.9.RELEASE.jar:5.0.9.RELEASE]
	at org.springframework.context.event.SimpleApplicationEventMulticaster.doInvokeListener(SimpleApplicationEventMulticaster.java:172) ~[spring-context-5.0.9.RELEASE.jar:5.0.9.RELEASE]
	at org.springframework.context.event.SimpleApplicationEventMulticaster.invokeListener(SimpleApplicationEventMulticaster.java:165) ~[spring-context-5.0.9.RELEASE.jar:5.0.9.RELEASE]
	at org.springframework.context.event.SimpleApplicationEventMulticaster.multicastEvent(SimpleApplicationEventMulticaster.java:139) ~[spring-context-5.0.9.RELEASE.jar:5.0.9.RELEASE]
	at org.springframework.context.support.AbstractApplicationContext.publishEvent(AbstractApplicationContext.java:400) ~[spring-context-5.0.9.RELEASE.jar:5.0.9.RELEASE]
	at org.springframework.context.support.AbstractApplicationContext.publishEvent(AbstractApplicationContext.java:354) ~[spring-context-5.0.9.RELEASE.jar:5.0.9.RELEASE]
	at org.springframework.context.support.AbstractApplicationContext.finishRefresh(AbstractApplicationContext.java:888) ~[spring-context-5.0.9.RELEASE.jar:5.0.9.RELEASE]
	at org.springframework.boot.web.servlet.context.ServletWebServerApplicationContext.finishRefresh(ServletWebServerApplicationContext.java:161) ~[spring-boot-2.0.5.RELEASE.jar:2.0.5.RELEASE]
	at org.springframework.context.support.AbstractApplicationContext.refresh(AbstractApplicationContext.java:553) ~[spring-context-5.0.9.RELEASE.jar:5.0.9.RELEASE]
	at org.springframework.boot.web.servlet.context.ServletWebServerApplicationContext.refresh(ServletWebServerApplicationContext.java:140) ~[spring-boot-2.0.5.RELEASE.jar:2.0.5.RELEASE]
	at org.springframework.boot.SpringApplication.refresh(SpringApplication.java:780) [spring-boot-2.0.5.RELEASE.jar:2.0.5.RELEASE]
	at org.springframework.boot.SpringApplication.refreshContext(SpringApplication.java:412) [spring-boot-2.0.5.RELEASE.jar:2.0.5.RELEASE]
	at org.springframework.boot.SpringApplication.run(SpringApplication.java:333) [spring-boot-2.0.5.RELEASE.jar:2.0.5.RELEASE]
	at org.springframework.boot.SpringApplication.run(SpringApplication.java:1277) [spring-boot-2.0.5.RELEASE.jar:2.0.5.RELEASE]
	at org.springframework.boot.SpringApplication.run(SpringApplication.java:1265) [spring-boot-2.0.5.RELEASE.jar:2.0.5.RELEASE]
	at com.rockingengineering.vault.VaultApplication.main(VaultApplication.java:10) [classes/:na]
Caused by: java.lang.IllegalArgumentException: Could not resolve placeholder 'client.pseudo.property.vault' in value "${client.pseudo.property.vault}"
	at org.springframework.util.PropertyPlaceholderHelper.parseStringValue(PropertyPlaceholderHelper.java:172) ~[spring-core-5.0.9.RELEASE.jar:5.0.9.RELEASE]
	at org.springframework.util.PropertyPlaceholderHelper.replacePlaceholders(PropertyPlaceholderHelper.java:124) ~[spring-core-5.0.9.RELEASE.jar:5.0.9.RELEASE]
	at org.springframework.core.env.AbstractPropertyResolver.doResolvePlaceholders(AbstractPropertyResolver.java:237) ~[spring-core-5.0.9.RELEASE.jar:5.0.9.RELEASE]
	at org.springframework.core.env.AbstractPropertyResolver.resolveRequiredPlaceholders(AbstractPropertyResolver.java:211) ~[spring-core-5.0.9.RELEASE.jar:5.0.9.RELEASE]
	at org.springframework.context.support.PropertySourcesPlaceholderConfigurer.lambda$processProperties$0(PropertySourcesPlaceholderConfigurer.java:175) ~[spring-context-5.0.9.RELEASE.jar:5.0.9.RELEASE]
	at org.springframework.beans.factory.support.AbstractBeanFactory.resolveEmbeddedValue(AbstractBeanFactory.java:839) ~[spring-beans-5.0.9.RELEASE.jar:5.0.9.RELEASE]
	at org.springframework.beans.factory.support.DefaultListableBeanFactory.doResolveDependency(DefaultListableBeanFactory.java:1083) ~[spring-beans-5.0.9.RELEASE.jar:5.0.9.RELEASE]
	at org.springframework.beans.factory.support.DefaultListableBeanFactory.resolveDependency(DefaultListableBeanFactory.java:1062) ~[spring-beans-5.0.9.RELEASE.jar:5.0.9.RELEASE]
	at org.springframework.beans.factory.annotation.AutowiredAnnotationBeanPostProcessor$AutowiredFieldElement.inject(AutowiredAnnotationBeanPostProcessor.java:583) ~[spring-beans-5.0.9.RELEASE.jar:5.0.9.RELEASE]
	at org.springframework.beans.factory.annotation.InjectionMetadata.inject(InjectionMetadata.java:90) ~[spring-beans-5.0.9.RELEASE.jar:5.0.9.RELEASE]
	at org.springframework.beans.factory.annotation.AutowiredAnnotationBeanPostProcessor.postProcessPropertyValues(AutowiredAnnotationBeanPostProcessor.java:372) ~[spring-beans-5.0.9.RELEASE.jar:5.0.9.RELEASE]
	... 33 common frames omitted

2018-10-11 18:08:01.139  INFO 97999 --- [       Thread-2] s.c.a.AnnotationConfigApplicationContext : Closing org.springframework.context.annotation.AnnotationConfigApplicationContext@3fc2959f: startup date [Thu Oct 11 18:07:49 IST 2018]; root of context hierarchy
2018-10-11 18:08:01.141  INFO 97999 --- [       Thread-2] o.s.s.c.ThreadPoolTaskScheduler          : Shutting down ExecutorService
`

The same code is able to load properties from GIT. Here is the client code - 

`@RefreshScope
@Api(value = "Vault Controller")
@RestController
public class VaultController {

	@Value("${client.pseudo.property}")
	private String pseudoProperty;

	@Value("${client.pseudo.property.vault}")
	private String proeprtyFromVault;

	@GetMapping("/property")
	public ResponseEntity<String> getProperty() {
		return ResponseEntity.ok(pseudoProperty);
	}

	@GetMapping("/property/vault")
	public ResponseEntity<String> getPropertyFromVault() {
		return ResponseEntity.ok(proeprtyFromVault);
	}
}`


Here is the configserver code -

`@EnableConfigServer
@SpringBootApplication
public class SpringConfigServerApplication {

	public static void main(String[] args) {
		SpringApplication.run(SpringConfigServerApplication.class, args);
	}

}`

And the corresponding `application.yml` -

`spring:
  application:
    name: configserver
  cloud:
    config:
      server:
        vault:
          port: 8200
          host: 127.0.0.1
        git:
          uri: https://github.com/weekly-drafts/config-repo-spring-cloud-configserver-vault
        native:
          search-locations: classpath:/
  profiles:
    active: default, native, git, vault
server:
  port: 8888`

Can you tell what I am missing here?

**Comment by navuniverse** [comment]
I am getting the same error while trying to use vault.

Here is my configclient `bootstrap.yml`

```
spring:
  application:
    name: configclient
  cloud:
    vault:
      token: f474964a-89bf-39e6-2e37-3d7de918f762
      uri: http://localhost:8888
    config:
      token: f474964a-89bf-39e6-2e37-3d7de918f762
      uri: http://localhost:8888
      headers:
        X-Vault-Token: f474964a-89bf-39e6-2e37-3d7de918f762
server:
  port: 8080
```
I am able to use vault from CLI using the same token. The error I am getting is -

```
2018-10-11 18:07:49.946  INFO 97999 --- [           main] s.c.a.AnnotationConfigApplicationContext : Refreshing org.springframework.context.annotation.AnnotationConfigApplicationContext@3fc2959f: startup date [Thu Oct 11 18:07:49 IST 2018]; root of context hierarchy
2018-10-11 18:07:50.389  INFO 97999 --- [           main] trationDelegate$BeanPostProcessorChecker : Bean 'configurationPropertiesRebinderAutoConfiguration' of type [org.springframework.cloud.autoconfigure.ConfigurationPropertiesRebinderAutoConfiguration$$EnhancerBySpringCGLIB$$c21aa722] is not eligible for getting processed by all BeanPostProcessors (for example: not eligible for auto-proxying)
2018-10-11 18:07:50.913  INFO 97999 --- [           main] o.s.s.c.ThreadPoolTaskScheduler          : Initializing ExecutorService 

  .   ____          _            __ _ _
 /\\ / ___'_ __ _ _(_)_ __  __ _ \ \ \ \
( ( )\___ | '_ | '_| | '_ \/ _` | \ \ \ \
 \\/  ___)| |_)| | | | | || (_| |  ) ) ) )
  '  |____| .__|_| |_|_| |_\__, | / / / /
 =========|_|==============|___/=/_/_/_/
 :: Spring Boot ::        (v2.0.5.RELEASE)

2018-10-11 18:07:53.579  WARN 97999 --- [           main] o.s.v.a.LifecycleAwareSessionManager     : Cannot enhance VaultToken to a LoginToken: Token self-lookup failed: 500 {"timestamp":"2018-10-11T12:37:53.557+0000","status":500,"error":"Internal Server Error","message":"No such label: token","path":"/v1/auth/token/lookup-self"}
2018-10-11 18:07:53.603  WARN 97999 --- [           main] LeaseEventPublisher$LoggingErrorListener : [RequestedSecret [path='secret/configclient', mode=ROTATE]] Lease [leaseId='null', leaseDuration=PT0S, renewable=false] Status 400 secret/configclient: {"timestamp":"2018-10-11T12:37:53.594+0000","status":400,"error":"Bad Request","message":"Missing required header: X-Config-Token","path":"/v1/secret/configclient"}

org.springframework.vault.VaultException: Status 400 secret/configclient: {"timestamp":"2018-10-11T12:37:53.594+0000","status":400,"error":"Bad Request","message":"Missing required header: X-Config-Token","path":"/v1/secret/configclient"}
	at org.springframework.vault.client.VaultResponses.buildException(VaultResponses.java:89) ~[spring-vault-core-2.0.1.RELEASE.jar:2.0.1.RELEASE]
	at org.springframework.vault.client.VaultResponses.buildException(VaultResponses.java:81) ~[spring-vault-core-2.0.1.RELEASE.jar:2.0.1.RELEASE]
	at org.springframework.vault.core.VaultTemplate.lambda$doRead$1(VaultTemplate.java:328) ~[spring-vault-core-2.0.1.RELEASE.jar:2.0.1.RELEASE]
	at org.springframework.vault.core.VaultTemplate.doWithSession(VaultTemplate.java:307) ~[spring-vault-core-2.0.1.RELEASE.jar:2.0.1.RELEASE]
	at org.springframework.vault.core.VaultTemplate.doRead(VaultTemplate.java:317) ~[spring-vault-core-2.0.1.RELEASE.jar:2.0.1.RELEASE]
	at org.springframework.vault.core.VaultTemplate.read(VaultTemplate.java:212) ~[spring-vault-core-2.0.1.RELEASE.jar:2.0.1.RELEASE]
	at org.springframework.vault.core.lease.SecretLeaseContainer.doGetSecrets(SecretLeaseContainer.java:545) [spring-vault-core-2.0.1.RELEASE.jar:2.0.1.RELEASE]
	at org.springframework.vault.core.lease.SecretLeaseContainer.start(SecretLeaseContainer.java:357) [spring-vault-core-2.0.1.RELEASE.jar:2.0.1.RELEASE]
	at org.springframework.vault.core.lease.SecretLeaseContainer.addRequestedSecret(SecretLeaseContainer.java:316) [spring-vault-core-2.0.1.RELEASE.jar:2.0.1.RELEASE]
	at org.springframework.vault.core.env.LeaseAwareVaultPropertySource.loadProperties(LeaseAwareVaultPropertySource.java:147) [spring-vault-core-2.0.1.RELEASE.jar:2.0.1.RELEASE]
	at org.springframework.vault.core.env.LeaseAwareVaultPropertySource.<init>(LeaseAwareVaultPropertySource.java:133) [spring-vault-core-2.0.1.RELEASE.jar:2.0.1.RELEASE]
	at org.springframework.cloud.vault.config.LeasingVaultPropertySourceLocator.createVaultPropertySource(LeasingVaultPropertySourceLocator.java:151) [spring-cloud-vault-config-2.0.1.RELEASE.jar:2.0.1.RELEASE]
	at org.springframework.cloud.vault.config.LeasingVaultPropertySourceLocator.createVaultPropertySource(LeasingVaultPropertySourceLocator.java:88) [spring-cloud-vault-config-2.0.1.RELEASE.jar:2.0.1.RELEASE]
	at org.springframework.cloud.vault.config.VaultPropertySourceLocatorSupport.doCreatePropertySources(VaultPropertySourceLocatorSupport.java:170) [spring-cloud-vault-config-2.0.1.RELEASE.jar:2.0.1.RELEASE]
	at org.springframework.cloud.vault.config.VaultPropertySourceLocatorSupport.createCompositePropertySource(VaultPropertySourceLocatorSupport.java:145) [spring-cloud-vault-config-2.0.1.RELEASE.jar:2.0.1.RELEASE]
	at org.springframework.cloud.vault.config.VaultPropertySourceLocatorSupport.locate(VaultPropertySourceLocatorSupport.java:116) [spring-cloud-vault-config-2.0.1.RELEASE.jar:2.0.1.RELEASE]
	at org.springframework.cloud.bootstrap.config.PropertySourceBootstrapConfiguration.initialize(PropertySourceBootstrapConfiguration.java:94) [spring-cloud-context-2.0.1.RELEASE.jar:2.0.1.RELEASE]
	at org.springframework.boot.SpringApplication.applyInitializers(SpringApplication.java:654) [spring-boot-2.0.5.RELEASE.jar:2.0.5.RELEASE]
	at org.springframework.boot.SpringApplication.prepareContext(SpringApplication.java:390) [spring-boot-2.0.5.RELEASE.jar:2.0.5.RELEASE]
	at org.springframework.boot.SpringApplication.run(SpringApplication.java:331) [spring-boot-2.0.5.RELEASE.jar:2.0.5.RELEASE]
	at org.springframework.boot.SpringApplication.run(SpringApplication.java:1277) [spring-boot-2.0.5.RELEASE.jar:2.0.5.RELEASE]
	at org.springframework.boot.SpringApplication.run(SpringApplication.java:1265) [spring-boot-2.0.5.RELEASE.jar:2.0.5.RELEASE]
	at com.rockingengineering.vault.VaultApplication.main(VaultApplication.java:10) [classes/:na]

2018-10-11 18:07:53.632  WARN 97999 --- [           main] LeaseEventPublisher$LoggingErrorListener : [RequestedSecret [path='secret/application', mode=ROTATE]] Lease [leaseId='null', leaseDuration=PT0S, renewable=false] Status 400 secret/application: {"timestamp":"2018-10-11T12:37:53.630+0000","status":400,"error":"Bad Request","message":"Missing required header: X-Config-Token","path":"/v1/secret/application"}

org.springframework.vault.VaultException: Status 400 secret/application: {"timestamp":"2018-10-11T12:37:53.630+0000","status":400,"error":"Bad Request","message":"Missing required header: X-Config-Token","path":"/v1/secret/application"}
	at org.springframework.vault.client.VaultResponses.buildException(VaultResponses.java:89) ~[spring-vault-core-2.0.1.RELEASE.jar:2.0.1.RELEASE]
	at org.springframework.vault.client.VaultResponses.buildException(VaultResponses.java:81) ~[spring-vault-core-2.0.1.RELEASE.jar:2.0.1.RELEASE]
	at org.springframework.vault.core.VaultTemplate.lambda$doRead$1(VaultTemplate.java:328) ~[spring-vault-core-2.0.1.RELEASE.jar:2.0.1.RELEASE]
	at org.springframework.vault.core.VaultTemplate.doWithSession(VaultTemplate.java:307) ~[spring-vault-core-2.0.1.RELEASE.jar:2.0.1.RELEASE]
	at org.springframework.vault.core.VaultTemplate.doRead(VaultTemplate.java:317) ~[spring-vault-core-2.0.1.RELEASE.jar:2.0.1.RELEASE]
	at org.springframework.vault.core.VaultTemplate.read(VaultTemplate.java:212) ~[spring-vault-core-2.0.1.RELEASE.jar:2.0.1.RELEASE]
	at org.springframework.vault.core.lease.SecretLeaseContainer.doGetSecrets(SecretLeaseContainer.java:545) [spring-vault-core-2.0.1.RELEASE.jar:2.0.1.RELEASE]
	at org.springframework.vault.core.lease.SecretLeaseContainer.start(SecretLeaseContainer.java:357) [spring-vault-core-2.0.1.RELEASE.jar:2.0.1.RELEASE]
	at org.springframework.vault.core.lease.SecretLeaseContainer.addRequestedSecret(SecretLeaseContainer.java:316) [spring-vault-core-2.0.1.RELEASE.jar:2.0.1.RELEASE]
	at org.springframework.vault.core.env.LeaseAwareVaultPropertySource.loadProperties(LeaseAwareVaultPropertySource.java:147) [spring-vault-core-2.0.1.RELEASE.jar:2.0.1.RELEASE]
	at org.springframework.vault.core.env.LeaseAwareVaultPropertySource.<init>(LeaseAwareVaultPropertySource.java:133) [spring-vault-core-2.0.1.RELEASE.jar:2.0.1.RELEASE]
	at org.springframework.cloud.vault.config.LeasingVaultPropertySourceLocator.createVaultPropertySource(LeasingVaultPropertySourceLocator.java:151) [spring-cloud-vault-config-2.0.1.RELEASE.jar:2.0.1.RELEASE]
	at org.springframework.cloud.vault.config.LeasingVaultPropertySourceLocator.createVaultPropertySource(LeasingVaultPropertySourceLocator.java:88) [spring-cloud-vault-config-2.0.1.RELEASE.jar:2.0.1.RELEASE]
	at org.springframework.cloud.vault.config.VaultPropertySourceLocatorSupport.doCreatePropertySources(VaultPropertySourceLocatorSupport.java:170) [spring-cloud-vault-config-2.0.1.RELEASE.jar:2.0.1.RELEASE]
	at org.springframework.cloud.vault.config.VaultPropertySourceLocatorSupport.createCompositePropertySource(VaultPropertySourceLocatorSupport.java:145) [spring-cloud-vault-config-2.0.1.RELEASE.jar:2.0.1.RELEASE]
	at org.springframework.cloud.vault.config.VaultPropertySourceLocatorSupport.locate(VaultPropertySourceLocatorSupport.java:116) [spring-cloud-vault-config-2.0.1.RELEASE.jar:2.0.1.RELEASE]
	at org.springframework.cloud.bootstrap.config.PropertySourceBootstrapConfiguration.initialize(PropertySourceBootstrapConfiguration.java:94) [spring-cloud-context-2.0.1.RELEASE.jar:2.0.1.RELEASE]
	at org.springframework.boot.SpringApplication.applyInitializers(SpringApplication.java:654) [spring-boot-2.0.5.RELEASE.jar:2.0.5.RELEASE]
	at org.springframework.boot.SpringApplication.prepareContext(SpringApplication.java:390) [spring-boot-2.0.5.RELEASE.jar:2.0.5.RELEASE]
	at org.springframework.boot.SpringApplication.run(SpringApplication.java:331) [spring-boot-2.0.5.RELEASE.jar:2.0.5.RELEASE]
	at org.springframework.boot.SpringApplication.run(SpringApplication.java:1277) [spring-boot-2.0.5.RELEASE.jar:2.0.5.RELEASE]
	at org.springframework.boot.SpringApplication.run(SpringApplication.java:1265) [spring-boot-2.0.5.RELEASE.jar:2.0.5.RELEASE]
	at com.rockingengineering.vault.VaultApplication.main(VaultApplication.java:10) [classes/:na]

2018-10-11 18:07:53.633  INFO 97999 --- [           main] b.c.PropertySourceBootstrapConfiguration : Located property source: CompositePropertySource {name='vault', propertySources=[LeaseAwareVaultPropertySource {name='secret/configclient'}, LeaseAwareVaultPropertySource {name='secret/application'}]}
2018-10-11 18:07:53.639  INFO 97999 --- [           main] c.c.c.ConfigServicePropertySourceLocator : Fetching config from server at : http://localhost:8888
2018-10-11 18:07:56.496  INFO 97999 --- [           main] c.c.c.ConfigServicePropertySourceLocator : Located environment: name=configclient, profiles=[default], label=null, version=null, state=null
2018-10-11 18:07:56.496  INFO 97999 --- [           main] b.c.PropertySourceBootstrapConfiguration : Located property source: CompositePropertySource {name='configService', propertySources=[MapPropertySource {name='https://github.com/weekly-drafts/config-repo-spring-cloud-configserver-vault/configclient.yml'}]}
2018-10-11 18:07:56.502  INFO 97999 --- [           main] c.r.vault.VaultApplication               : No active profile set, falling back to default profiles: default
2018-10-11 18:07:56.516  INFO 97999 --- [           main] ConfigServletWebServerApplicationContext : Refreshing org.springframework.boot.web.servlet.context.AnnotationConfigServletWebServerApplicationContext@60a2630a: startup date [Thu Oct 11 18:07:56 IST 2018]; parent: org.springframework.context.annotation.AnnotationConfigApplicationContext@3fc2959f
2018-10-11 18:07:57.909  INFO 97999 --- [           main] o.s.cloud.context.scope.GenericScope     : BeanFactory id=e9255d82-de63-3800-b389-53a2229e780a
2018-10-11 18:07:58.032  INFO 97999 --- [           main] trationDelegate$BeanPostProcessorChecker : Bean 'org.springframework.cloud.autoconfigure.ConfigurationPropertiesRebinderAutoConfiguration' of type [org.springframework.cloud.autoconfigure.ConfigurationPropertiesRebinderAutoConfiguration$$EnhancerBySpringCGLIB$$c21aa722] is not eligible for getting processed by all BeanPostProcessors (for example: not eligible for auto-proxying)
2018-10-11 18:07:58.564  INFO 97999 --- [           main] o.s.b.w.embedded.tomcat.TomcatWebServer  : Tomcat initialized with port(s): 8080 (http)
2018-10-11 18:07:58.589  INFO 97999 --- [           main] o.apache.catalina.core.StandardService   : Starting service [Tomcat]
2018-10-11 18:07:58.589  INFO 97999 --- [           main] org.apache.catalina.core.StandardEngine  : Starting Servlet Engine: Apache Tomcat/8.5.34
2018-10-11 18:07:58.593  INFO 97999 --- [ost-startStop-1] o.a.catalina.core.AprLifecycleListener   : The APR based Apache Tomcat Native library which allows optimal performance in production environments was not found on the java.library.path: [/Users/naveen/Library/Java/Extensions:/Library/Java/Extensions:/Network/Library/Java/Extensions:/System/Library/Java/Extensions:/usr/lib/java:.]
2018-10-11 18:07:58.706  INFO 97999 --- [ost-startStop-1] o.a.c.c.C.[Tomcat].[localhost].[/]       : Initializing Spring embedded WebApplicationContext
2018-10-11 18:07:58.706  INFO 97999 --- [ost-startStop-1] o.s.web.context.ContextLoader            : Root WebApplicationContext: initialization completed in 2190 ms
2018-10-11 18:07:59.376  INFO 97999 --- [ost-startStop-1] o.s.b.w.servlet.FilterRegistrationBean   : Mapping filter: 'characterEncodingFilter' to: [/*]
2018-10-11 18:07:59.377  INFO 97999 --- [ost-startStop-1] o.s.b.w.servlet.FilterRegistrationBean   : Mapping filter: 'webMvcMetricsFilter' to: [/*]
2018-10-11 18:07:59.377  INFO 97999 --- [ost-startStop-1] o.s.b.w.servlet.FilterRegistrationBean   : Mapping filter: 'hiddenHttpMethodFilter' to: [/*]
2018-10-11 18:07:59.377  INFO 97999 --- [ost-startStop-1] o.s.b.w.servlet.FilterRegistrationBean   : Mapping filter: 'httpPutFormContentFilter' to: [/*]
2018-10-11 18:07:59.377  INFO 97999 --- [ost-startStop-1] o.s.b.w.servlet.FilterRegistrationBean   : Mapping filter: 'requestContextFilter' to: [/*]
2018-10-11 18:07:59.377  INFO 97999 --- [ost-startStop-1] o.s.b.w.servlet.FilterRegistrationBean   : Mapping filter: 'httpTraceFilter' to: [/*]
2018-10-11 18:07:59.377  INFO 97999 --- [ost-startStop-1] o.s.b.w.servlet.ServletRegistrationBean  : Servlet dispatcherServlet mapped to [/]
2018-10-11 18:07:59.965  INFO 97999 --- [           main] s.w.s.m.m.a.RequestMappingHandlerMapping : Mapped "{[/property],methods=[GET]}" onto public org.springframework.http.ResponseEntity<java.lang.String> com.rockingengineering.vault.controller.VaultController.getProperty()
2018-10-11 18:07:59.966  INFO 97999 --- [           main] s.w.s.m.m.a.RequestMappingHandlerMapping : Mapped "{[/property/vault],methods=[GET]}" onto public org.springframework.http.ResponseEntity<java.lang.String> com.rockingengineering.vault.controller.VaultController.getPropertyFromVault()
2018-10-11 18:07:59.969  INFO 97999 --- [           main] s.w.s.m.m.a.RequestMappingHandlerMapping : Mapped "{[/v2/api-docs],methods=[GET],produces=[application/json || application/hal+json]}" onto public org.springframework.http.ResponseEntity<springfox.documentation.spring.web.json.Json> springfox.documentation.swagger2.web.Swagger2Controller.getDocumentation(java.lang.String,javax.servlet.http.HttpServletRequest)
2018-10-11 18:07:59.973  INFO 97999 --- [           main] s.w.s.m.m.a.RequestMappingHandlerMapping : Mapped "{[/swagger-resources/configuration/ui]}" onto org.springframework.http.ResponseEntity<springfox.documentation.swagger.web.UiConfiguration> springfox.documentation.swagger.web.ApiResourceController.uiConfiguration()
2018-10-11 18:07:59.974  INFO 97999 --- [           main] s.w.s.m.m.a.RequestMappingHandlerMapping : Mapped "{[/swagger-resources/configuration/security]}" onto org.springframework.http.ResponseEntity<springfox.documentation.swagger.web.SecurityConfiguration> springfox.documentation.swagger.web.ApiResourceController.securityConfiguration()
2018-10-11 18:07:59.975  INFO 97999 --- [           main] s.w.s.m.m.a.RequestMappingHandlerMapping : Mapped "{[/swagger-resources]}" onto org.springframework.http.ResponseEntity<java.util.List<springfox.documentation.swagger.web.SwaggerResource>> springfox.documentation.swagger.web.ApiResourceController.swaggerResources()
2018-10-11 18:07:59.978  INFO 97999 --- [           main] s.w.s.m.m.a.RequestMappingHandlerMapping : Mapped "{[/error]}" onto public org.springframework.http.ResponseEntity<java.util.Map<java.lang.String, java.lang.Object>> org.springframework.boot.autoconfigure.web.servlet.error.BasicErrorController.error(javax.servlet.http.HttpServletRequest)
2018-10-11 18:07:59.979  INFO 97999 --- [           main] s.w.s.m.m.a.RequestMappingHandlerMapping : Mapped "{[/error],produces=[text/html]}" onto public org.springframework.web.servlet.ModelAndView org.springframework.boot.autoconfigure.web.servlet.error.BasicErrorController.errorHtml(javax.servlet.http.HttpServletRequest,javax.servlet.http.HttpServletResponse)
2018-10-11 18:08:00.101  INFO 97999 --- [           main] o.s.b.a.e.web.EndpointLinksResolver      : Exposing 2 endpoint(s) beneath base path '/actuator'
2018-10-11 18:08:00.116  INFO 97999 --- [           main] s.b.a.e.w.s.WebMvcEndpointHandlerMapping : Mapped "{[/actuator/health],methods=[GET],produces=[application/vnd.spring-boot.actuator.v2+json || application/json]}" onto public java.lang.Object org.springframework.boot.actuate.endpoint.web.servlet.AbstractWebMvcEndpointHandlerMapping$OperationHandler.handle(javax.servlet.http.HttpServletRequest,java.util.Map<java.lang.String, java.lang.String>)
2018-10-11 18:08:00.117  INFO 97999 --- [           main] s.b.a.e.w.s.WebMvcEndpointHandlerMapping : Mapped "{[/actuator/info],methods=[GET],produces=[application/vnd.spring-boot.actuator.v2+json || application/json]}" onto public java.lang.Object org.springframework.boot.actuate.endpoint.web.servlet.AbstractWebMvcEndpointHandlerMapping$OperationHandler.handle(javax.servlet.http.HttpServletRequest,java.util.Map<java.lang.String, java.lang.String>)
2018-10-11 18:08:00.118  INFO 97999 --- [           main] s.b.a.e.w.s.WebMvcEndpointHandlerMapping : Mapped "{[/actuator],methods=[GET],produces=[application/vnd.spring-boot.actuator.v2+json || application/json]}" onto protected java.util.Map<java.lang.String, java.util.Map<java.lang.String, org.springframework.boot.actuate.endpoint.web.Link>> org.springframework.boot.actuate.endpoint.web.servlet.WebMvcEndpointHandlerMapping.links(javax.servlet.http.HttpServletRequest,javax.servlet.http.HttpServletResponse)
2018-10-11 18:08:00.266  INFO 97999 --- [           main] o.s.w.s.handler.SimpleUrlHandlerMapping  : Mapped URL path [/**/favicon.ico] onto handler of type [class org.springframework.web.servlet.resource.ResourceHttpRequestHandler]
2018-10-11 18:08:00.397  INFO 97999 --- [           main] s.w.s.m.m.a.RequestMappingHandlerAdapter : Looking for @ControllerAdvice: org.springframework.boot.web.servlet.context.AnnotationConfigServletWebServerApplicationContext@60a2630a: startup date [Thu Oct 11 18:07:56 IST 2018]; parent: org.springframework.context.annotation.AnnotationConfigApplicationContext@3fc2959f
2018-10-11 18:08:00.443  INFO 97999 --- [           main] o.s.w.s.handler.SimpleUrlHandlerMapping  : Mapped URL path [/webjars/**] onto handler of type [class org.springframework.web.servlet.resource.ResourceHttpRequestHandler]
2018-10-11 18:08:00.443  INFO 97999 --- [           main] o.s.w.s.handler.SimpleUrlHandlerMapping  : Mapped URL path [/**] onto handler of type [class org.springframework.web.servlet.resource.ResourceHttpRequestHandler]
2018-10-11 18:08:00.798  INFO 97999 --- [           main] o.s.j.e.a.AnnotationMBeanExporter        : Registering beans for JMX exposure on startup
2018-10-11 18:08:00.811  INFO 97999 --- [           main] o.s.j.e.a.AnnotationMBeanExporter        : Bean with name 'environmentManager' has been autodetected for JMX exposure
2018-10-11 18:08:00.812  INFO 97999 --- [           main] o.s.j.e.a.AnnotationMBeanExporter        : Bean with name 'refreshScope' has been autodetected for JMX exposure
2018-10-11 18:08:00.815  INFO 97999 --- [           main] o.s.j.e.a.AnnotationMBeanExporter        : Bean with name 'configurationPropertiesRebinder' has been autodetected for JMX exposure
2018-10-11 18:08:00.821  INFO 97999 --- [           main] o.s.j.e.a.AnnotationMBeanExporter        : Located managed bean 'environmentManager': registering with JMX server as MBean [org.springframework.cloud.context.environment:name=environmentManager,type=EnvironmentManager]
2018-10-11 18:08:00.831  INFO 97999 --- [           main] o.s.j.e.a.AnnotationMBeanExporter        : Located managed bean 'refreshScope': registering with JMX server as MBean [org.springframework.cloud.context.scope.refresh:name=refreshScope,type=RefreshScope]
2018-10-11 18:08:00.842  INFO 97999 --- [           main] o.s.j.e.a.AnnotationMBeanExporter        : Located managed bean 'configurationPropertiesRebinder': registering with JMX server as MBean [org.springframework.cloud.context.properties:name=configurationPropertiesRebinder,context=60a2630a,type=ConfigurationPropertiesRebinder]
2018-10-11 18:08:00.985  INFO 97999 --- [           main] o.s.c.support.DefaultLifecycleProcessor  : Starting beans in phase 2147483647
2018-10-11 18:08:00.986  INFO 97999 --- [           main] d.s.w.p.DocumentationPluginsBootstrapper : Context refreshed
2018-10-11 18:08:01.004  INFO 97999 --- [           main] d.s.w.p.DocumentationPluginsBootstrapper : Found 1 custom documentation plugin(s)
2018-10-11 18:08:01.016  INFO 97999 --- [           main] s.d.s.w.s.ApiListingReferenceScanner     : Scanning for api listing references
2018-10-11 18:08:01.099  WARN 97999 --- [           main] ConfigServletWebServerApplicationContext : Exception encountered during context initialization - cancelling refresh attempt: org.springframework.beans.factory.BeanCreationException: Error creating bean with name 'scopedTarget.vaultController': Injection of autowired dependencies failed; nested exception is java.lang.IllegalArgumentException: Could not resolve placeholder 'client.pseudo.property.vault' in value "${client.pseudo.property.vault}"
2018-10-11 18:08:01.101  INFO 97999 --- [           main] o.s.j.e.a.AnnotationMBeanExporter        : Unregistering JMX-exposed beans on shutdown
2018-10-11 18:08:01.102  INFO 97999 --- [           main] o.s.j.e.a.AnnotationMBeanExporter        : Unregistering JMX-exposed beans
2018-10-11 18:08:01.107  INFO 97999 --- [           main] o.apache.catalina.core.StandardService   : Stopping service [Tomcat]
2018-10-11 18:08:01.131  INFO 97999 --- [           main] ConditionEvaluationReportLoggingListener : 

Error starting ApplicationContext. To display the conditions report re-run your application with 'debug' enabled.
2018-10-11 18:08:01.138 ERROR 97999 --- [           main] o.s.boot.SpringApplication               : Application run failed

org.springframework.beans.factory.BeanCreationException: Error creating bean with name 'scopedTarget.vaultController': Injection of autowired dependencies failed; nested exception is java.lang.IllegalArgumentException: Could not resolve placeholder 'client.pseudo.property.vault' in value "${client.pseudo.property.vault}"
	at org.springframework.beans.factory.annotation.AutowiredAnnotationBeanPostProcessor.postProcessPropertyValues(AutowiredAnnotationBeanPostProcessor.java:378) ~[spring-beans-5.0.9.RELEASE.jar:5.0.9.RELEASE]
	at org.springframework.beans.factory.support.AbstractAutowireCapableBeanFactory.populateBean(AbstractAutowireCapableBeanFactory.java:1341) ~[spring-beans-5.0.9.RELEASE.jar:5.0.9.RELEASE]
	at org.springframework.beans.factory.support.AbstractAutowireCapableBeanFactory.doCreateBean(AbstractAutowireCapableBeanFactory.java:572) ~[spring-beans-5.0.9.RELEASE.jar:5.0.9.RELEASE]
	at org.springframework.beans.factory.support.AbstractAutowireCapableBeanFactory.createBean(AbstractAutowireCapableBeanFactory.java:495) ~[spring-beans-5.0.9.RELEASE.jar:5.0.9.RELEASE]
	at org.springframework.beans.factory.support.AbstractBeanFactory.lambda$doGetBean$1(AbstractBeanFactory.java:353) ~[spring-beans-5.0.9.RELEASE.jar:5.0.9.RELEASE]
	at org.springframework.cloud.context.scope.GenericScope$BeanLifecycleWrapper.getBean(GenericScope.java:390) ~[spring-cloud-context-2.0.1.RELEASE.jar:2.0.1.RELEASE]
	at org.springframework.cloud.context.scope.GenericScope.get(GenericScope.java:184) ~[spring-cloud-context-2.0.1.RELEASE.jar:2.0.1.RELEASE]
	at org.springframework.beans.factory.support.AbstractBeanFactory.doGetBean(AbstractBeanFactory.java:350) ~[spring-beans-5.0.9.RELEASE.jar:5.0.9.RELEASE]
	at org.springframework.beans.factory.support.AbstractBeanFactory.getBean(AbstractBeanFactory.java:199) ~[spring-beans-5.0.9.RELEASE.jar:5.0.9.RELEASE]
	at org.springframework.context.support.AbstractApplicationContext.getBean(AbstractApplicationContext.java:1089) ~[spring-context-5.0.9.RELEASE.jar:5.0.9.RELEASE]
	at org.springframework.cloud.context.scope.refresh.RefreshScope.eagerlyInitialize(RefreshScope.java:126) ~[spring-cloud-context-2.0.1.RELEASE.jar:2.0.1.RELEASE]
	at org.springframework.cloud.context.scope.refresh.RefreshScope.start(RefreshScope.java:117) ~[spring-cloud-context-2.0.1.RELEASE.jar:2.0.1.RELEASE]
	at sun.reflect.NativeMethodAccessorImpl.invoke0(Native Method) ~[na:1.8.0_121]
	at sun.reflect.NativeMethodAccessorImpl.invoke(NativeMethodAccessorImpl.java:62) ~[na:1.8.0_121]
	at sun.reflect.DelegatingMethodAccessorImpl.invoke(DelegatingMethodAccessorImpl.java:43) ~[na:1.8.0_121]
	at java.lang.reflect.Method.invoke(Method.java:498) ~[na:1.8.0_121]
	at org.springframework.context.event.ApplicationListenerMethodAdapter.doInvoke(ApplicationListenerMethodAdapter.java:261) ~[spring-context-5.0.9.RELEASE.jar:5.0.9.RELEASE]
	at org.springframework.context.event.ApplicationListenerMethodAdapter.processEvent(ApplicationListenerMethodAdapter.java:180) ~[spring-context-5.0.9.RELEASE.jar:5.0.9.RELEASE]
	at org.springframework.context.event.ApplicationListenerMethodAdapter.onApplicationEvent(ApplicationListenerMethodAdapter.java:142) ~[spring-context-5.0.9.RELEASE.jar:5.0.9.RELEASE]
	at org.springframework.context.event.SimpleApplicationEventMulticaster.doInvokeListener(SimpleApplicationEventMulticaster.java:172) ~[spring-context-5.0.9.RELEASE.jar:5.0.9.RELEASE]
	at org.springframework.context.event.SimpleApplicationEventMulticaster.invokeListener(SimpleApplicationEventMulticaster.java:165) ~[spring-context-5.0.9.RELEASE.jar:5.0.9.RELEASE]
	at org.springframework.context.event.SimpleApplicationEventMulticaster.multicastEvent(SimpleApplicationEventMulticaster.java:139) ~[spring-context-5.0.9.RELEASE.jar:5.0.9.RELEASE]
	at org.springframework.context.support.AbstractApplicationContext.publishEvent(AbstractApplicationContext.java:400) ~[spring-context-5.0.9.RELEASE.jar:5.0.9.RELEASE]
	at org.springframework.context.support.AbstractApplicationContext.publishEvent(AbstractApplicationContext.java:354) ~[spring-context-5.0.9.RELEASE.jar:5.0.9.RELEASE]
	at org.springframework.context.support.AbstractApplicationContext.finishRefresh(AbstractApplicationContext.java:888) ~[spring-context-5.0.9.RELEASE.jar:5.0.9.RELEASE]
	at org.springframework.boot.web.servlet.context.ServletWebServerApplicationContext.finishRefresh(ServletWebServerApplicationContext.java:161) ~[spring-boot-2.0.5.RELEASE.jar:2.0.5.RELEASE]
	at org.springframework.context.support.AbstractApplicationContext.refresh(AbstractApplicationContext.java:553) ~[spring-context-5.0.9.RELEASE.jar:5.0.9.RELEASE]
	at org.springframework.boot.web.servlet.context.ServletWebServerApplicationContext.refresh(ServletWebServerApplicationContext.java:140) ~[spring-boot-2.0.5.RELEASE.jar:2.0.5.RELEASE]
	at org.springframework.boot.SpringApplication.refresh(SpringApplication.java:780) [spring-boot-2.0.5.RELEASE.jar:2.0.5.RELEASE]
	at org.springframework.boot.SpringApplication.refreshContext(SpringApplication.java:412) [spring-boot-2.0.5.RELEASE.jar:2.0.5.RELEASE]
	at org.springframework.boot.SpringApplication.run(SpringApplication.java:333) [spring-boot-2.0.5.RELEASE.jar:2.0.5.RELEASE]
	at org.springframework.boot.SpringApplication.run(SpringApplication.java:1277) [spring-boot-2.0.5.RELEASE.jar:2.0.5.RELEASE]
	at org.springframework.boot.SpringApplication.run(SpringApplication.java:1265) [spring-boot-2.0.5.RELEASE.jar:2.0.5.RELEASE]
	at com.rockingengineering.vault.VaultApplication.main(VaultApplication.java:10) [classes/:na]
Caused by: java.lang.IllegalArgumentException: Could not resolve placeholder 'client.pseudo.property.vault' in value "${client.pseudo.property.vault}"
	at org.springframework.util.PropertyPlaceholderHelper.parseStringValue(PropertyPlaceholderHelper.java:172) ~[spring-core-5.0.9.RELEASE.jar:5.0.9.RELEASE]
	at org.springframework.util.PropertyPlaceholderHelper.replacePlaceholders(PropertyPlaceholderHelper.java:124) ~[spring-core-5.0.9.RELEASE.jar:5.0.9.RELEASE]
	at org.springframework.core.env.AbstractPropertyResolver.doResolvePlaceholders(AbstractPropertyResolver.java:237) ~[spring-core-5.0.9.RELEASE.jar:5.0.9.RELEASE]
	at org.springframework.core.env.AbstractPropertyResolver.resolveRequiredPlaceholders(AbstractPropertyResolver.java:211) ~[spring-core-5.0.9.RELEASE.jar:5.0.9.RELEASE]
	at org.springframework.context.support.PropertySourcesPlaceholderConfigurer.lambda$processProperties$0(PropertySourcesPlaceholderConfigurer.java:175) ~[spring-context-5.0.9.RELEASE.jar:5.0.9.RELEASE]
	at org.springframework.beans.factory.support.AbstractBeanFactory.resolveEmbeddedValue(AbstractBeanFactory.java:839) ~[spring-beans-5.0.9.RELEASE.jar:5.0.9.RELEASE]
	at org.springframework.beans.factory.support.DefaultListableBeanFactory.doResolveDependency(DefaultListableBeanFactory.java:1083) ~[spring-beans-5.0.9.RELEASE.jar:5.0.9.RELEASE]
	at org.springframework.beans.factory.support.DefaultListableBeanFactory.resolveDependency(DefaultListableBeanFactory.java:1062) ~[spring-beans-5.0.9.RELEASE.jar:5.0.9.RELEASE]
	at org.springframework.beans.factory.annotation.AutowiredAnnotationBeanPostProcessor$AutowiredFieldElement.inject(AutowiredAnnotationBeanPostProcessor.java:583) ~[spring-beans-5.0.9.RELEASE.jar:5.0.9.RELEASE]
	at org.springframework.beans.factory.annotation.InjectionMetadata.inject(InjectionMetadata.java:90) ~[spring-beans-5.0.9.RELEASE.jar:5.0.9.RELEASE]
	at org.springframework.beans.factory.annotation.AutowiredAnnotationBeanPostProcessor.postProcessPropertyValues(AutowiredAnnotationBeanPostProcessor.java:372) ~[spring-beans-5.0.9.RELEASE.jar:5.0.9.RELEASE]
	... 33 common frames omitted

2018-10-11 18:08:01.139  INFO 97999 --- [       Thread-2] s.c.a.AnnotationConfigApplicationContext : Closing org.springframework.context.annotation.AnnotationConfigApplicationContext@3fc2959f: startup date [Thu Oct 11 18:07:49 IST 2018]; root of context hierarchy
2018-10-11 18:08:01.141  INFO 97999 --- [       Thread-2] o.s.s.c.ThreadPoolTaskScheduler          : Shutting down ExecutorService
```

The same code is able to load properties from GIT. Here is the client code - 

```
@RefreshScope
@Api(value = "Vault Controller")
@RestController
public class VaultController {

	@Value("${client.pseudo.property}")
	private String pseudoProperty;

	@Value("${client.pseudo.property.vault}")
	private String proeprtyFromVault;

	@GetMapping("/property")
	public ResponseEntity<String> getProperty() {
		return ResponseEntity.ok(pseudoProperty);
	}

	@GetMapping("/property/vault")
	public ResponseEntity<String> getPropertyFromVault() {
		return ResponseEntity.ok(proeprtyFromVault);
	}
}
```


Here is the configserver code -

```
@EnableConfigServer
@SpringBootApplication
public class SpringConfigServerApplication {

	public static void main(String[] args) {
		SpringApplication.run(SpringConfigServerApplication.class, args);
	}

}
```

And the corresponding `application.yml` -

```
spring:
  application:
    name: configserver
  cloud:
    config:
      server:
        vault:
          port: 8200
          host: 127.0.0.1
        git:
          uri: https://github.com/weekly-drafts/config-repo-spring-cloud-configserver-vault
        native:
          search-locations: classpath:/
  profiles:
    active: default, native, git, vault
server:
  port: 8888
```

Can you tell what I am missing here?

**Comment by ryanjbaxter** [comment]
Please open a separate issue
